{
  "updated_at": "2026-10-31T05:38:48.406742+00:00",
  "count": 292,
  "verified": 272,
  "endpoints": [
    {
      "url": "tg://proxy?server=1.hide.newflamingodomain.co.uk&port=8443&secret=dd104462821249bd7ac519130220c25d09",
      "server": "1.hide.newflamingodomain.co.uk",
      "port": 8443,
      "secret": "dd104462821249bd7ac519130220c25d09",
      "endpoint": "1.hide.newflamingodomain.co.uk:8443",
      "verified": true,
      "check_ms": 597.58,
      "rtt_ms": 597.46,
      "engine": "library",
      "error": null,
      "median_rtt_ms": 710.71,
      "success_rate": 1.0,
      "rtt_trend": "improving",
      "samples": 10,
      "ads": {
        "status": "unknown",
        "channel": null,
        "checked_at": null
      }
    },
    {
      "url": "tg://proxy?server=128.140.49.115&port=8443&secret=eeNEgYdJvXrFGRMCIMJdCQAAq5W5G55ZWt0YW5ldC5jb21mYXJheqF2LmNvbXZhbi5uYWp2YS5jb20AAAAAAAAAAAAAAAAAAAAAAAAAAAAAAAAAAAAAAAAAAAAAAAAAAAAAAAAAAAAAAAAAAAAAAAAAAAAAAAAAAAAAAAAAAAAAAAAAAAAAAAA",
      "server": "128.140.49.115",
      "port": 8443,
      "secret": "eeNEgYdJvXrFGRMCIMJdCQAAq5W5G55ZWt0YW5ldC5jb21mYXJheqF2LmNvbXZhbi5uYWp2YS5jb20AAAAAAAAAAAAAAAAAAAAAAAAAAAAAAAAAAAAAAAAAAAAAAAAAAAAAAAAAAAAAAAAAAAAAAAAAAAAAAAAAAAAAAAAAAAAAAAAAAAAAAAA",
      "endpoint": "128.140.49.115:8443",
      "verified": true,
      "check_ms": 508.49,
      "rtt_ms": 508.33,
      "engine": "library",
      "error": null,
      "median_rtt_ms": 485.83,
      "success_rate": 1.0,
      "rtt_trend": "unknown",
      "samples": 2,
      "ads": {
        "status": "unknown",
        "channel": null,
        "checked_at": null
      }
    },
    {
      "url": "tg://proxy?server=159.69.9.248&port=8443&secret=dd104462821249bd7ac519130220c25d09",
      "server": "159.69.9.248",
      "port": 8443,
      "secret": "dd104462821249bd7ac519130220c25d09",
      "endpoint": "159.69.9.248:8443",
      "verified": true,
      "check_ms": 502.96,
      "rtt_ms": 502.87,
      "engine": "library",
      "error": null,
      "median_rtt_ms": 480.05,
      "success_rate": 1.0,
      "rtt_trend": "stable",
      "samples": 10,
      "ads": {
        "status": "unknown",
        "channel": null,
        "checked_at": null
      }
    },
    {
      "url": "tg://proxy?server=178.105.127.56&port=8443&secret=EERighJJvXrFGRMCIMjdCQ",
      "server": "178.105.127.56",
      "port": 8443,
      "secret": "EERighJJvXrFGRMCIMjdCQ",
      "endpoint": "178.105.127.56:8443",
      "verified": true,
      "check_ms": 506.41,
      "rtt_ms": 506.32,
      "engine": "library",
      "error": null,
      "median_rtt_ms": 484.55,
      "success_rate": 1.0,
      "rtt_trend": "stable",
      "samples": 10,
      "ads": {
        "status": "unknown",
        "channel": null,
        "checked_at": null
      }
    },
    {
      "url": "tg://proxy?server=178.105.201.7&port=8443&secret=EERighJJvXrFGRMCIMjdCQ",
      "server": "178.105.201.7",
      "port": 8443,
      "secret": "EERighJJvXrFGRMCIMjdCQ",
      "endpoint": "178.105.201.7:8443",
      "verified": true,
      "check_ms": 504.08,
      "rtt_ms": 503.98,
      "engine": "library",
      "error": null,
      "median_rtt_ms": 486.65,
      "success_rate": 1.0,
      "rtt_trend": "stable",
      "samples": 10,
      "ads": {
        "status": "unknown",
        "channel": null,
        "checked_at": null
      }
    },
    {
      "url": "tg://proxy?server=17fh.masi.ir.he6fhd.ru&port=8443&secret=dd104462821249bd7ac519130220c25d09",
      "server": "17fh.masi.ir.he6fhd.ru",
      "port": 8443,
      "secret": "dd104462821249bd7ac519130220c25d09",
      "endpoint": "17fh.masi.ir.he6fhd.ru:8443",
      "verified": true,
      "check_ms": 681.77,
      "rtt_ms": 681.68,
      "engine": "library",
      "error": null,
      "median_rtt_ms": 657.48,
      "success_rate": 1.0,
      "rtt_trend": "stable",
      "samples": 10,
      "ads": {
        "status": "unknown",
        "channel": null,
        "checked_at": null
      }
    },
    {
      "url": "tg://proxy?server=188.206-197-43.ir&port=8443&secret=3RBEBIGHSV36xZoDAiDCXLM",
      "server": "188.206-197-43.ir",
      "port": 8443,
      "secret": "3RBEBIGHSV36xZoDAiDCXLM",
      "endpoint": "188.206-197-43.ir:8443",
      "verified": true,
      "check_ms": 892.25,
      "rtt_ms": 892.15,
      "engine": "library",
      "error": null,
      "median_rtt_ms": 773.23,
      "success_rate": 1.0,
      "rtt_trend": "unknown",
      "samples": 2,
      "ads": {
        "status": "unknown",
        "channel": null,
        "checked_at": null
      }
    },
    {
      "url": "tg://proxy?server=1y23.e7.yayayajd.co.uk&port=8443&secret=dd104462821249bd7ac519130220c25d09",
      "server": "1y23.e7.yayayajd.co.uk",
      "port": 8443,
      "secret": "dd104462821249bd7ac519130220c25d09",
      "endpoint": "1y23.e7.yayayajd.co.uk:8443",
      "verified": true,
      "check_ms": 661.71,
      "rtt_ms": 661.6,
      "engine": "library",
      "error": null,
      "median_rtt_ms": 630.23,
      "success_rate": 1.0,
      "rtt_trend": "stable",
      "samples": 10,
      "ads": {
        "status": "unknown",
        "channel": null,
        "checked_at": null
      }
    },
    {
      "url": "tg://proxy?server=208.87.242.223&port=8443&secret=EERighJJvXrFGRMCIMjdCQ",
      "server": "208.87.242.223",
      "port": 8443,
      "secret": "EERighJJvXrFGRMCIMjdCQ",
      "endpoint": "208.87.242.223:8443",
      "verified": true,
      "check_ms": 207.8,
      "rtt_ms": 207.68,
      "engine": "library",
      "error": null,
      "median_rtt_ms": 263.06,
      "success_rate": 1.0,
      "rtt_trend": "improving",
      "samples": 10,
      "ads": {
        "status": "unknown",
        "channel": null,
        "checked_at": null
      }
    },
    {
      "url": "tg://proxy?server=21.hide.newflamingodomain.co.uk&port=8443&secret=dd104462821249bd7ac519130220c25d09",
      "server": "21.hide.newflamingodomain.co.uk",
      "port": 8443,
      "secret": "dd104462821249bd7ac519130220c25d09",
      "endpoint": "21.hide.newflamingodomain.co.uk:8443",
      "verified": true,
      "check_ms": 592.61,
      "rtt_ms": 592.51,
      "engine": "library",
      "error": null,
      "median_rtt_ms": 615.86,
      "success_rate": 1.0,
      "rtt_trend": "improving",
      "samples": 10,
      "ads": {
        "status": "unknown",
        "channel": null,
        "checked_at": null
      }
    },
    {
      "url": "tg://proxy?server=31.hide.newflamingodomain.co.uk&port=8443&secret=dd104462821249bd7ac519130220c25d09",
      "server": "31.hide.newflamingodomain.co.uk",
      "port": 8443,
      "secret": "dd104462821249bd7ac519130220c25d09",
      "endpoint": "31.hide.newflamingodomain.co.uk:8443",
      "verified": true,
      "check_ms": 597.03,
      "rtt_ms": 596.93,
      "engine": "library",
      "error": null,
      "median_rtt_ms": 684.54,
      "success_rate": 1.0,
      "rtt_trend": "improving",
      "samples": 10,
      "ads": {
        "status": "unknown",
        "channel": null,
        "checked_at": null
      }
    },
    {
      "url": "tg://proxy?server=333.antony-gordon.co.uk&port=8443&secret=eeNEgYdJvXrFGRMCIMJdCQ",
      "server": "333.antony-gordon.co.uk",
      "port": 8443,
      "secret": "eeNEgYdJvXrFGRMCIMJdCQ",
      "endpoint": "333.antony-gordon.co.uk:8443",
      "verified": true,
      "check_ms": 507.31,
      "rtt_ms": 507.13,
      "engine": "library",
      "error": null,
      "median_rtt_ms": 506.78,
      "success_rate": 1.0,
      "rtt_trend": "stable",
      "samples": 10,
      "ads": {
        "status": "unknown",
        "channel": null,
        "checked_at": null
      }
    },
    {
      "url": "tg://proxy?server=333.mtprotonewrunningproxasia.info&port=8443&secret=eeNEgYdJvXrFGRMCIMJdCQ",
      "server": "333.mtprotonewrunningproxasia.info",
      "port": 8443,
      "secret": "eeNEgYdJvXrFGRMCIMJdCQ",
      "endpoint": "333.mtprotonewrunningproxasia.info:8443",
      "verified": true,
      "check_ms": 510.84,
      "rtt_ms": 510.77,
      "engine": "library",
      "error": null,
      "median_rtt_ms": 506.3,
      "success_rate": 1.0,
      "rtt_trend": "stable",
      "samples": 10,
      "ads": {
        "status": "unknown",
        "channel": null,
        "checked_at": null
      }
    },
    {
      "url": "tg://proxy?server=3etare.co.uk&port=8443&secret=eeNEgYdJvXrFGRMCIMJdCQ",
      "server": "3etare.co.uk",
      "port": 8443,
      "secret": "eeNEgYdJvXrFGRMCIMJdCQ",
      "endpoint": "3etare.co.uk:8443",
      "verified": true,
      "check_ms": 584.77,
      "rtt_ms": 584.69,
      "engine": "library",
      "error": null,
      "median_rtt_ms": 584.83,
      "success_rate": 1.0,
      "rtt_trend": "stable",
      "samples": 10,
      "ads": {
        "status": "unknown",
        "channel": null,
        "checked_at": null
      }
    },
    {
      "url": "tg://proxy?server=41.hide.newflamingodomain.co.uk&port=8443&secret=dd104462821249bd7ac519130220c25d09",
      "server": "41.hide.newflamingodomain.co.uk",
      "port": 8443,
      "secret": "dd104462821249bd7ac519130220c25d09",
      "endpoint": "41.hide.newflamingodomain.co.uk:8443",
      "verified": true,
      "check_ms": 582.0,
      "rtt_ms": 581.91,
      "engine": "library",
      "error": null,
      "median_rtt_ms": 586.72,
      "success_rate": 1.0,
      "rtt_trend": "improving",
      "samples": 10,
      "ads": {
        "status": "unknown",
        "channel": null,
        "checked_at": null
      }
    },
    {
      "url": "tg://proxy?server=49.12.36.40&port=8443&secret=EERighJJvXrFGRMCIMjdCQ",
      "server": "49.12.36.40",
      "port": 8443,
      "secret": "EERighJJvXrFGRMCIMjdCQ",
      "endpoint": "49.12.36.40:8443",
      "verified": true,
      "check_ms": 510.61,
      "rtt_ms": 510.46,
      "engine": "library",
      "error": null,
      "median_rtt_ms": 486.35,
      "success_rate": 1.0,
      "rtt_trend": "stable",
      "samples": 10,
      "ads": {